phase,title,note,priority
deconstruct,SKILL: Post-Exploitation and Lateral Movement,"Goal: develop enough hands-on understanding of Metasploit, Mimikatz, and BloodHound to identify where CLI friction and poor output design slow operators down, then produce a build document for a GUI that makes session management and credential workflows readable and fast.",high
deconstruct,Metasploit framework structure,"Modules: exploits, payloads, auxiliaries, post. msfconsole navigation, search, use, set, run workflow.",high
deconstruct,payload types and staging,"Singles vs stagers vs stages. Meterpreter vs shell. Reverse vs bind connections. When each applies.",high
deconstruct,Meterpreter session management,"getuid, sysinfo, ps, migrate, hashdump, upload, download. Core session commands before going further.",high
deconstruct,privilege escalation concepts,"Local exploits, token impersonation, misconfigured services, unquoted paths. getsystem in Meterpreter.",high
deconstruct,Mimikatz credential extraction,"sekurlsa::logonpasswords, lsadump::sam, pass-the-hash concepts. Understand what each dumps and why.",high
deconstruct,BloodHound AD enumeration,"SharpHound data collection, neo4j graph database, attack path queries. Finding shortest path to Domain Admin.",medium
deconstruct,lateral movement techniques,"Pass-the-hash, pass-the-ticket, PsExec, WMI execution. Moving between hosts using harvested credentials.",medium
deconstruct,persistence mechanisms,"Registry run keys, scheduled tasks, service installation, startup folder. Understanding detection surfaces.",medium
deconstruct,pivoting and port forwarding,"Meterpreter portfwd, socks proxy setup, routing through compromised hosts to reach isolated segments.",low
deconstruct,log evasion basics,"Clearing event logs, timestomping, understanding what artifacts each action leaves.",low
selfcorrect,session stability checks,"Is the Meterpreter session stable? Migrate to a stable process before running noisy post modules.",high
selfcorrect,AV detection indicators,"Did your payload get caught? Check VirusTotal in offline mode. Understand what triggers signatures.",high
selfcorrect,Mimikatz output validation,"Cross-reference dumped hashes against known test accounts. Confirm you are reading the right fields.",high
selfcorrect,BloodHound query interpretation,"Can you explain why a path exists? Do not just follow arrows. Understand each edge type.",medium
selfcorrect,privilege level confirmation,"Always run getuid and getprivs after escalation. Confirm you have what you think you have.",medium
selfcorrect,reference: HackTricks,"book.hacktricks.xyz - comprehensive post-exploitation reference. Organized by OS and technique.",medium
selfcorrect,reference: PayloadsAllTheThings,"github.com/swisskyrepo/PayloadsAllTheThings - technique collection with working examples.",low
barriers,lab environment isolation — critical,"Snapshots before every session. All targets must be VMs you own. BloodHound needs a dedicated AD lab.",high
barriers,Windows Defender management,"Disable or configure exclusions on test VMs. Real-world evasion is a separate skill. Start clean.",high
barriers,AD lab setup,"Windows Server VM with Active Directory and at least one domain-joined workstation. Required for BloodHound and Mimikatz.",high
barriers,Metasploit database setup,"postgresql must be running. Run msfdb init before first session. Confirm with db_status inside msfconsole.",high
barriers,snapshot discipline,"Revert to clean snapshot before each session. Post-exploitation leaves significant system changes.",high
barriers,BloodHound neo4j version,"BloodHound has specific neo4j version requirements. Check the BloodHound wiki before installing.",medium
barriers,time investment reality,"Post-exploitation has a steep early curve. Budget sessions 1-3 as pure orientation not results.",medium
practice,session 1: Metasploit orientation,"Navigate msfconsole. Search for ms17_010. Set up against Metasploitable2. Get a Meterpreter session. Run basic commands.",high
practice,session 2: Meterpreter deep dive,"From active session: migrate, hashdump, screenshot, keyscan_start. Document every command and output.",high
practice,session 3: privilege escalation,"Start with low-priv shell. Run local_exploit_suggester. Attempt getsystem. Document what works and why.",high
practice,session 4: Mimikatz via Meterpreter,"Load kiwi module. Run creds_all. Cross-reference output with known test account passwords. Verify accuracy.",high
practice,session 5: AD lab setup and SharpHound,"Set up Windows AD lab. Run SharpHound collector. Import zip into BloodHound. Explore the graph.",medium
practice,session 6: BloodHound attack paths,"Run pre-built queries: shortest path to Domain Admin, Kerberoastable accounts, AS-REP Roastable users.",medium
practice,session 7: lateral movement,"Use harvested credentials to authenticate to a second VM via PsExec or WMI. Document the chain.",medium
practice,session 8: GUI build document sprint,"Using pain points from sessions 1-7, write the build document for the post-exploitation GUI. Define session management UI, credential display, and AD path visualization.",high
